{
  "contract_version": "task-contract-v1",
  "goal": "Set up and use an internet fax service to receive faxes via email.",
  "goal_predicates": [
    {
      "id": "wikihow_outcome",
      "predicate": {
        "all": [
          {
            "eq": [
              "$state.accounts",
              {
                "acc_efax_99": {
                  "provider": "eFax Free",
                  "email": "user@example.com",
                  "fax_number": "+1-800-555-0199",
                  "format": "pdf",
                  "status": "trial_active"
                }
              }
            ]
          },
          {
            "eq": [
              "$state.workflow_commit_audit.committed",
              true
            ]
          }
        ]
      }
    }
  ],
  "invariants": [
    {
      "id": "workflow_state_remains_structured",
      "predicate": {
        "all": [
          {
            "exists": "$state.accounts"
          },
          {
            "exists": "$state.workflow_context"
          }
        ]
      }
    }
  ],
  "requirements": {
    "semantic_recovery": false,
    "async_decision": false,
    "goal_grounded_verification": true
  },
  "forbidden_shortcuts": [
    "claim completion without producing the WikiHow workflow outcome",
    "claim completion without inspecting the resulting state",
    "perform workflow_commit commit without target-specific reviewed evidence"
  ],
  "expected_reasoning_features": [
    "derived_object_dependency",
    "goal_grounded_verification"
  ],
  "counterfactual_axes": []
}
