{
  "contract_version": "task-contract-v1",
  "goal": "Set up Open Directory in the OS X Mavericks Server app.",
  "goal_predicates": [
    {
      "id": "wikihow_outcome",
      "predicate": {
        "all": [
          {
            "eq": [
              "$state.jobs",
              {
                "job_od_setup_992": {
                  "id": "job_od_setup_992",
                  "type": "create_database",
                  "status": "completed",
                  "progress": 100
                }
              }
            ]
          },
          {
            "eq": [
              "$state.services",
              {
                "open_directory": {
                  "id": "open_directory",
                  "name": "Open Directory",
                  "status": "on",
                  "configured": true,
                  "config": {
                    "role": "master",
                    "admin_password": "SecurePass123!",
                    "organization_name": "Acme Corp",
                    "admin_email": "admin@acme.com"
                  }
                }
              }
            ]
          },
          {
            "eq": [
              "$state.workflow_commit_audit.committed",
              true
            ]
          }
        ]
      }
    }
  ],
  "invariants": [
    {
      "id": "workflow_state_remains_structured",
      "predicate": {
        "all": [
          {
            "exists": "$state.jobs"
          },
          {
            "exists": "$state.services"
          },
          {
            "exists": "$state.workflow_context"
          }
        ]
      }
    }
  ],
  "requirements": {
    "semantic_recovery": false,
    "async_decision": false,
    "goal_grounded_verification": true
  },
  "forbidden_shortcuts": [
    "claim completion without producing the WikiHow workflow outcome",
    "claim completion without inspecting the resulting state",
    "perform workflow_commit commit without target-specific reviewed evidence"
  ],
  "expected_reasoning_features": [
    "derived_object_dependency",
    "goal_grounded_verification"
  ],
  "counterfactual_axes": []
}
