{
  "contract_version": "task-contract-v1",
  "goal": "Organize a classroom library using smart scanners, computer software, and mobile apps.",
  "goal_predicates": [
    {
      "id": "wikihow_outcome",
      "predicate": {
        "all": [
          {
            "eq": [
              "$state.books",
              {
                "9780439023528": {
                  "id": "9780439023528",
                  "title": "The Hunger Games",
                  "author": "Suzanne Collins",
                  "publisher": "Scholastic",
                  "status": "saved",
                  "reading_level": "Z",
                  "shelf_location": "Shelf A-1"
                }
              }
            ]
          },
          {
            "eq": [
              "$state.workflow_commit_audit.committed",
              true
            ]
          }
        ]
      }
    }
  ],
  "invariants": [
    {
      "id": "workflow_state_remains_structured",
      "predicate": {
        "all": [
          {
            "exists": "$state.books"
          },
          {
            "exists": "$state.workflow_context"
          }
        ]
      }
    }
  ],
  "requirements": {
    "semantic_recovery": false,
    "async_decision": false,
    "goal_grounded_verification": true
  },
  "forbidden_shortcuts": [
    "claim completion without producing the WikiHow workflow outcome",
    "claim completion without inspecting the resulting state",
    "perform workflow_commit commit without target-specific reviewed evidence"
  ],
  "expected_reasoning_features": [
    "derived_object_dependency",
    "goal_grounded_verification"
  ],
  "counterfactual_axes": []
}
