{
  "contract_version": "task-contract-v1",
  "goal": "Temporarily prevent a Mac computer from sleeping by adjusting Energy Saver settings.",
  "goal_predicates": [
    {
      "id": "wikihow_outcome",
      "predicate": {
        "all": [
          {
            "eq": [
              "$state.current_app",
              "System Preferences"
            ]
          },
          {
            "eq": [
              "$state.preferences",
              {
                "energy_saver_settings": {
                  "id": "energy_saver_settings",
                  "computer_sleep_minutes": 180,
                  "display_sleep_minutes": 15,
                  "prevent_sleep_when_display_off": true,
                  "put_hard_disks_to_sleep": false
                }
              }
            ]
          },
          {
            "eq": [
              "$state.workflow_commit_audit.committed",
              true
            ]
          }
        ]
      }
    }
  ],
  "invariants": [
    {
      "id": "workflow_state_remains_structured",
      "predicate": {
        "all": [
          {
            "exists": "$state.current_app"
          },
          {
            "exists": "$state.preferences"
          },
          {
            "exists": "$state.workflow_context"
          }
        ]
      }
    }
  ],
  "requirements": {
    "semantic_recovery": false,
    "async_decision": false,
    "goal_grounded_verification": true
  },
  "forbidden_shortcuts": [
    "claim completion without producing the WikiHow workflow outcome",
    "claim completion without inspecting the resulting state",
    "perform workflow_commit commit without target-specific reviewed evidence"
  ],
  "expected_reasoning_features": [
    "derived_object_dependency",
    "goal_grounded_verification"
  ],
  "counterfactual_axes": []
}
