{
  "contract_version": "task-contract-v1",
  "goal": "Open Windows Task Manager to monitor and end high CPU usage applications and processes.",
  "goal_predicates": [
    {
      "id": "wikihow_outcome",
      "predicate": {
        "all": [
          {
            "eq": [
              "$state.processes",
              {
                "proc_system_kernel": {
                  "id": "proc_system_kernel",
                  "name": "ntoskrnl.exe",
                  "description": "NT Kernel & System",
                  "cpu_usage": "2%",
                  "type": "system"
                }
              }
            ]
          },
          {
            "eq": [
              "$state.task_manager_opened",
              true
            ]
          },
          {
            "eq": [
              "$state.workflow_commit_audit.committed",
              true
            ]
          }
        ]
      }
    }
  ],
  "invariants": [
    {
      "id": "workflow_state_remains_structured",
      "predicate": {
        "all": [
          {
            "exists": "$state.processes"
          },
          {
            "exists": "$state.task_manager_opened"
          },
          {
            "exists": "$state.workflow_context"
          }
        ]
      }
    }
  ],
  "requirements": {
    "semantic_recovery": false,
    "async_decision": false,
    "goal_grounded_verification": true
  },
  "forbidden_shortcuts": [
    "claim completion without producing the WikiHow workflow outcome",
    "claim completion without inspecting the resulting state",
    "perform workflow_commit commit without target-specific reviewed evidence"
  ],
  "expected_reasoning_features": [
    "derived_object_dependency",
    "goal_grounded_verification"
  ],
  "counterfactual_axes": []
}
