{
  "contract_version": "task-contract-v1",
  "goal": "How to view and sync media content, and install apps from an SD card on a Windows Phone.",
  "goal_predicates": [
    {
      "id": "wikihow_outcome",
      "predicate": {
        "all": [
          {
            "eq": [
              "$state.apps",
              {
                "app_whatsapp": {
                  "id": "app_whatsapp",
                  "name": "WhatsApp",
                  "status": "installed"
                }
              }
            ]
          },
          {
            "eq": [
              "$state.jobs",
              {
                "job_install_whatsapp": {
                  "id": "job_install_whatsapp",
                  "status": "completed",
                  "app_id": "app_whatsapp"
                }
              }
            ]
          },
          {
            "eq": [
              "$state.workflow_commit_audit.committed",
              true
            ]
          }
        ]
      }
    }
  ],
  "invariants": [
    {
      "id": "workflow_state_remains_structured",
      "predicate": {
        "all": [
          {
            "exists": "$state.apps"
          },
          {
            "exists": "$state.jobs"
          },
          {
            "exists": "$state.workflow_context"
          }
        ]
      }
    }
  ],
  "requirements": {
    "semantic_recovery": false,
    "async_decision": false,
    "goal_grounded_verification": true
  },
  "forbidden_shortcuts": [
    "claim completion without producing the WikiHow workflow outcome",
    "claim completion without inspecting the resulting state",
    "perform workflow_commit commit without target-specific reviewed evidence"
  ],
  "expected_reasoning_features": [
    "derived_object_dependency",
    "goal_grounded_verification"
  ],
  "counterfactual_axes": []
}
